{
  "content": "Your browser version is too low, some content may not display properly, please download the\nlatest version!\n\n[HOME](https://potato.im/) [APPS](https://potato.im/apps) [DEVELOPER](https://potato.im/api) [FAQ](https://potato.im/faq) [PRIVACY](https://potato.im/privacy) [NEWS](https://potato.im/news)\n\n简体中文English繁體中文\n[__](https://twitter.com/PotatoChatApp)\n\n__\n\nFeedback\n\n__\n[Service\\\\\n\\\\\n__](https://tdkh.gsxhtmy.com/chatIndex?kefu_id=kefu2&extra=eyJhcHBfdmVyc2lvbiI6IiIsIm9zX3R5cGUiOiJ3ZWIiLCJrZXlfaWQiOiIiLCJ1c2VyX2lkIjoiIiwiYWNjb3VudCI6IiJ9) [News\\\\\n\\\\\n__](https://potato.im/news)\n\nFeedback一\n\nEnter the problem you are experiencing\n\n**0**/520\n\nUnited States+1\n\nAfghanistan\n\n+93\n\nAlbania\n\n+355\n\nAlgeria\n\n+213\n\nAmerican Samoa\n\n+1684\n\nAndorra\n\n+376\n\nAngola\n\n+244\n\nAnguilla\n\n+1264\n\nAntarctica\n\n+0\n\nAntigua and Barbuda\n\n+1268\n\nArgentina\n\n+54\n\nArmenia\n\n+374\n\nAruba\n\n+297\n\nAustralia\n\n+61\n\nAustria\n\n+43\n\nAzerbaijan\n\n+994\n\nBahamas\n\n+1242\n\nBahrain\n\n+973\n\nBangladesh\n\n+880\n\nBarbados\n\n+1246\n\nBelarus\n\n+375\n\nBelgium\n\n+32\n\nBelize\n\n+501\n\nBenin\n\n+229\n\nBermuda\n\n+1441\n\nBhutan\n\n+975\n\nBolivia\n\n+591\n\nBosnia and Herzegovina\n\n+387\n\nBotswana\n\n+267\n\nBouvet Island\n\n+0\n\nBrazil\n\n+55\n\nBritish Indian Ocean Territory\n\n+246\n\nBrunei Darussalam\n\n+673\n\nBulgaria\n\n+359\n\nBurkina Faso\n\n+226\n\nBurundi\n\n+257\n\nCambodia\n\n+855\n\nCameroon\n\n+237\n\nCanada\n\n+1\n\nCape Verde\n\n+238\n\nCayman Islands\n\n+1345\n\nCentral African Republic\n\n+236\n\nChad\n\n+235\n\nChile\n\n+56\n\nChina\n\n+86\n\nChristmas Island\n\n+61\n\nCocos (Keeling) Islands\n\n+672\n\nColombia\n\n+57\n\nComoros\n\n+269\n\nCongo\n\n+242\n\nCongo, the Democratic Republic of the\n\n+242\n\nCook Islands\n\n+682\n\nCosta Rica\n\n+506\n\nCote D'Ivoire\n\n+225\n\nCroatia\n\n+385\n\nCuba\n\n+53\n\nCyprus\n\n+357\n\nCzech Republic\n\n+420\n\nDenmark\n\n+45\n\nDjibouti\n\n+253\n\nDominica\n\n+1767\n\nDominican Republic\n\n+1809\n\nEcuador\n\n+593\n\nEgypt\n\n+20\n\nEl Salvador\n\n+503\n\nEquatorial Guinea\n\n+240\n\nEritrea\n\n+291\n\nEstonia\n\n+372\n\nEthiopia\n\n+251\n\nFalkland Islands (Malvinas)\n\n+500\n\nFaroe Islands\n\n+298\n\nFiji\n\n+679\n\nFinland\n\n+358\n\nFrance\n\n+33\n\nFrench Guiana\n\n+594\n\nFrench Polynesia\n\n+689\n\nFrench Southern Territories\n\n+0\n\nGabon\n\n+241\n\nGambia\n\n+220\n\nGeorgia\n\n+995\n\nGermany\n\n+49\n\nGhana\n\n+233\n\nGibraltar\n\n+350\n\nGreece\n\n+30\n\nGreenland\n\n+299\n\nGrenada\n\n+1473\n\nGuadeloupe\n\n+590\n\nGuam\n\n+1671\n\nGuatemala\n\n+502\n\nGuinea\n\n+224\n\nGuinea-Bissau\n\n+245\n\nGuyana\n\n+592\n\nHaiti\n\n+509\n\nHeard Island and Mcdonald Islands\n\n+0\n\nHoly See (Vatican City State)\n\n+39\n\nHonduras\n\n+504\n\nHong Kong\n\n+852\n\nHungary\n\n+36\n\nIceland\n\n+354\n\nIndia\n\n+91\n\nIndonesia\n\n+62\n\nIran, Islamic Republic of\n\n+98\n\nIraq\n\n+964\n\nIreland\n\n+353\n\nIsrael\n\n+972\n\nItaly\n\n+39\n\nJamaica\n\n+1876\n\nJapan\n\n+81\n\nJordan\n\n+962\n\nKazakhstan\n\n+7\n\nKenya\n\n+254\n\nKiribati\n\n+686\n\nKorea, Democratic People's Republic of\n\n+850\n\nKorea, Republic of\n\n+82\n\nKuwait\n\n+965\n\nKyrgyzstan\n\n+996\n\nLao People's Democratic Republic\n\n+856\n\nLatvia\n\n+371\n\nLebanon\n\n+961\n\nLesotho\n\n+266\n\nLiberia\n\n+231\n\nLibyan Arab Jamahiriya\n\n+218\n\nLiechtenstein\n\n+423\n\nLithuania\n\n+370\n\nLuxembourg\n\n+352\n\nMacao\n\n+853\n\nMacedonia, the Former Yugoslav Republic of\n\n+389\n\nMadagascar\n\n+261\n\nMalawi\n\n+265\n\nMalaysia\n\n+60\n\nMaldives\n\n+960\n\nMali\n\n+223\n\nMalta\n\n+356\n\nMarshall Islands\n\n+692\n\nMartinique\n\n+596\n\nMauritania\n\n+222\n\nMauritius\n\n+230\n\nMayotte\n\n+269\n\nMexico\n\n+52\n\nMicronesia, Federated States of\n\n+691\n\nMoldova, Republic of\n\n+373\n\nMonaco\n\n+377\n\nMongolia\n\n+976\n\nMontserrat\n\n+1664\n\nMorocco\n\n+212\n\nMozambique\n\n+258\n\nMyanmar\n\n+95\n\nNamibia\n\n+264\n\nNauru\n\n+674\n\nNepal\n\n+977\n\nNetherlands\n\n+31\n\nNetherlands Antilles\n\n+599\n\nNew Caledonia\n\n+687\n\nNew Zealand\n\n+64\n\nNicaragua\n\n+505\n\nNiger\n\n+227\n\nNigeria\n\n+234\n\nNiue\n\n+683\n\nNorfolk Island\n\n+672\n\nNorthern Mariana Islands\n\n+1670\n\nNorway\n\n+47\n\nOman\n\n+968\n\nPakistan\n\n+92\n\nPalau\n\n+680\n\nPalestinian Territory, Occupied\n\n+970\n\nPanama\n\n+507\n\nPapua New Guinea\n\n+675\n\nParaguay\n\n+595\n\nPeru\n\n+51\n\nPhilippines\n\n+63\n\nPitcairn\n\n+0\n\nPoland\n\n+48\n\nPortugal\n\n+351\n\nPuerto Rico\n\n+1787\n\nQatar\n\n+974\n\nReunion\n\n+262\n\nRomania\n\n+40\n\nRussian Federation\n\n+70\n\nRwanda\n\n+250\n\nSaint Helena\n\n+290\n\nSaint Kitts and Nevis\n\n+1869\n\nSaint Lucia\n\n+1758\n\nSaint Pierre and Miquelon\n\n+508\n\nSaint Vincent and the Grenadines\n\n+1784\n\nSamoa\n\n+684\n\nSan Marino\n\n+378\n\nSao Tome and Principe\n\n+239\n\nSaudi Arabia\n\n+966\n\nSenegal\n\n+221\n\nSerbia and Montenegro\n\n+381\n\nSeychelles\n\n+248\n\nSierra Leone\n\n+232\n\nSingapore\n\n+65\n\nSlovakia\n\n+421\n\nSlovenia\n\n+386\n\nSolomon Islands\n\n+677\n\nSomalia\n\n+252\n\nSouth Africa\n\n+27\n\nSouth Georgia and the South Sandwich Islands\n\n+0\n\nSpain\n\n+34\n\nSri Lanka\n\n+94\n\nSudan\n\n+249\n\nSuriname\n\n+597\n\nSvalbard and Jan Mayen\n\n+47\n\nSwaziland\n\n+268\n\nSweden\n\n+46\n\nSwitzerland\n\n+41\n\nSyrian Arab Republic\n\n+963\n\nTaiwan, Province of China\n\n+886\n\nTajikistan\n\n+992\n\nTanzania, United Republic of\n\n+255\n\nThailand\n\n+66\n\nTimor-Leste\n\n+670\n\nTogo\n\n+228\n\nTokelau\n\n+690\n\nTonga\n\n+676\n\nTrinidad and Tobago\n\n+1868\n\nTunisia\n\n+216\n\nTurkey\n\n+90\n\nTurkmenistan\n\n+7370\n\nTurks and Caicos Islands\n\n+1649\n\nTuvalu\n\n+688\n\nUganda\n\n+256\n\nUkraine\n\n+380\n\nUnited Arab Emirates\n\n+971\n\nUnited Kingdom\n\n+44\n\nUnited States\n\n+1\n\nUnited States Minor Outlying Islands\n\n+1\n\nUruguay\n\n+598\n\nUzbekistan\n\n+998\n\nVanuatu\n\n+678\n\nVenezuela\n\n+58\n\nViet Nam\n\n+84\n\nVirgin Islands, British\n\n+1284\n\nVirgin Islands, U.s.\n\n+1340\n\nWallis and Futuna\n\n+681\n\nWestern Sahara\n\n+212\n\nYemen\n\n+967\n\nZambia\n\n+260\n\nZimbabwe\n\n+263\n\nUpload photos\n\n![](https://potato.im/resources/images/btn_addphoto.png)\n\n\\*Two pictures could be uploaded at most one time, and the network capacity size of every picture cannot be over 3M.\n\nSubmit\n\nHot issue\n\nMobile phone can not be logged in, quickly bind email address\n\nHOT\n\n[Why do I need to register by email?](https://potato.im/faq?md=whyBindEmail)\n\nHOT\n\n[How to download the latest version of Potato?](https://potato.im/apps)\n\n[What if the registration/login fails to send the verification code?](https://potato.im/faq?md=RegMsgNotCode)\n\n[Potato FAQ](https://potato.im/faq)\n\nService\n\n×\n\nGraphic verification\n\n![captcha](https://potato.im/)\n\n![refresh](https://potato.im/resources/images/email/icon_refresh.png)\n\n\"\n\nOK\n\nBinding Email一\n\nPlease enter your phone number\n\nAfghanistan,+93Albania,+355Algeria,+213American Samoa,+1684Andorra,+376Angola,+244Anguilla,+1264Antarctica,+0Antigua and Barbuda,+1268Argentina,+54Armenia,+374Aruba,+297Australia,+61Austria,+43Azerbaijan,+994Bahamas,+1242Bahrain,+973Bangladesh,+880Barbados,+1246Belarus,+375Belgium,+32Belize,+501Benin,+229Bermuda,+1441Bhutan,+975Bolivia,+591Bosnia and Herzegovina,+387Botswana,+267Bouvet Island,+0Brazil,+55British Indian Ocean Territory,+246Brunei Darussalam,+673Bulgaria,+359Burkina Faso,+226Burundi,+257Cambodia,+855Cameroon,+237Canada,+1Cape Verde,+238Cayman Islands,+1345Central African Republic,+236Chad,+235Chile,+56China,+86Christmas Island,+61Cocos (Keeling) Islands,+672Colombia,+57Comoros,+269Congo,+242Congo, the Democratic Republic of the,+242Cook Islands,+682Costa Rica,+506Cote D'Ivoire,+225Croatia,+385Cuba,+53Cyprus,+357Czech Republic,+420Denmark,+45Djibouti,+253Dominica,+1767Dominican Republic,+1809Ecuador,+593Egypt,+20El Salvador,+503Equatorial Guinea,+240Eritrea,+291Estonia,+372Ethiopia,+251Falkland Islands (Malvinas),+500Faroe Islands,+298Fiji,+679Finland,+358France,+33French Guiana,+594French Polynesia,+689French Southern Territories,+0Gabon,+241Gambia,+220Georgia,+995Germany,+49Ghana,+233Gibraltar,+350Greece,+30Greenland,+299Grenada,+1473Guadeloupe,+590Guam,+1671Guatemala,+502Guinea,+224Guinea-Bissau,+245Guyana,+592Haiti,+509Heard Island and Mcdonald Islands,+0Holy See (Vatican City State),+39Honduras,+504Hong Kong,+852Hungary,+36Iceland,+354India,+91Indonesia,+62Iran, Islamic Republic of,+98Iraq,+964Ireland,+353Israel,+972Italy,+39Jamaica,+1876Japan,+81Jordan,+962Kazakhstan,+7Kenya,+254Kiribati,+686Korea, Democratic People's Republic of,+850Korea, Republic of,+82Kuwait,+965Kyrgyzstan,+996Lao People's Democratic Republic,+856Latvia,+371Lebanon,+961Lesotho,+266Liberia,+231Libyan Arab Jamahiriya,+218Liechtenstein,+423Lithuania,+370Luxembourg,+352Macao,+853Macedonia, the Former Yugoslav Republic of,+389Madagascar,+261Malawi,+265Malaysia,+60Maldives,+960Mali,+223Malta,+356Marshall Islands,+692Martinique,+596Mauritania,+222Mauritius,+230Mayotte,+269Mexico,+52Micronesia, Federated States of,+691Moldova, Republic of,+373Monaco,+377Mongolia,+976Montserrat,+1664Morocco,+212Mozambique,+258Myanmar,+95Namibia,+264Nauru,+674Nepal,+977Netherlands,+31Netherlands Antilles,+599New Caledonia,+687New Zealand,+64Nicaragua,+505Niger,+227Nigeria,+234Niue,+683Norfolk Island,+672Northern Mariana Islands,+1670Norway,+47Oman,+968Pakistan,+92Palau,+680Palestinian Territory, Occupied,+970Panama,+507Papua New Guinea,+675Paraguay,+595Peru,+51Philippines,+63Pitcairn,+0Poland,+48Portugal,+351Puerto Rico,+1787Qatar,+974Reunion,+262Romania,+40Russian Federation,+70Rwanda,+250Saint Helena,+290Saint Kitts and Nevis,+1869Saint Lucia,+1758Saint Pierre and Miquelon,+508Saint Vincent and the Grenadines,+1784Samoa,+684San Marino,+378Sao Tome and Principe,+239Saudi Arabia,+966Senegal,+221Serbia and Montenegro,+381Seychelles,+248Sierra Leone,+232Singapore,+65Slovakia,+421Slovenia,+386Solomon Islands,+677Somalia,+252South Africa,+27South Georgia and the South Sandwich Islands,+0Spain,+34Sri Lanka,+94Sudan,+249Suriname,+597Svalbard and Jan Mayen,+47Swaziland,+268Sweden,+46Switzerland,+41Syrian Arab Republic,+963Taiwan, Province of China,+886Tajikistan,+992Tanzania, United Republic of,+255Thailand,+66Timor-Leste,+670Togo,+228Tokelau,+690Tonga,+676Trinidad and Tobago,+1868Tunisia,+216Turkey,+90Turkmenistan,+7370Turks and Caicos Islands,+1649Tuvalu,+688Uganda,+256Ukraine,+380United Arab Emirates,+971United Kingdom,+44United States,+1United States Minor Outlying Islands,+1Uruguay,+598Uzbekistan,+998Vanuatu,+678Venezuela,+58Viet Nam,+84Virgin Islands, British,+1284Virgin Islands, U.s.,+1340Wallis and Futuna,+681Western Sahara,+212Yemen,+967Zambia,+260Zimbabwe,+263\n\n+\n\n\"\n\nPlease enter phone verification code\n\nGet CAPTCHA\n\n\"\n\nNext step\n\n![logo](https://potato.im/resources/images/email/logo@2x.png)\n\nPlease send a text message to the corresponding phone number for verification\n\n电信用户请编辑短信 1111\n发送至:1234\n\n移动用户请编辑短信 2222\n发送至:2234\n\n联通用户请编辑短信 3333\n发送至:3234\n\nEnsure that the mobile phone number and message content are entered correctly to avoid sending errors.\n\nAlready send\n\n+899 66668888\n\n![avatar](https://potato.im/)\n\nNickname\n\nUser name\n\nThis email address is already tied to an account:e\\*\\*\\*\\*mail@email.com\n\nIf you have any questions, [please contact customer service](https://tdkh.gsxhtmy.com/chatIndex?kefu_id=kefu2&extra=eyJhcHBfdmVyc2lvbiI6IiIsIm9zX3R5cGUiOiJ3ZWIiLCJrZXlfaWQiOiIiLCJ1c2VyX2lkIjoiIiwiYWNjb3VudCI6IiJ9)\n\nSuccessfully bound mailbox\n\nPlease use your e-mail to log in\n\nYou will bind an e-mail address to this account\n\n下一步\n\nLast step\n\nDownload Potato：Mobile\n\n[![android](https://potato.im/resources/images/email/icon_apps_android.png)Potato Android](https://ptapk.potato.im/android/latest.apk)\n\n[![iphone](https://potato.im/resources/images/email/icon_apps_ios.png)Potato iPhone](https://itunes.apple.com/us/app/potato-chat/id1204726898)\n\nDesktop\n\n[![windows](https://potato.im/resources/images/email/icon_apps_win.png)Potato Windows Desktop](https://download.potato.im/win/Potato_Desktop2.47.28.zip)\n\n[![macos](https://potato.im/resources/images/email/icon_apps_macos.png)Potato MacOS Desktop](https://download.potato.im/mac/Potato_Desktop2.47.3.dmg)\n\n[![linux](https://potato.im/resources/images/email/icon_apps_linux.png)Potato Linux Desktop](https://download.potato.im/linux/Potato_Desktop.2.37.tar.gz)\n\nPlease enter your e-mail address\n\n\"\n\nPlease enter the e-mail verification code\n\nGet CAPTCHA\n\n\"\n\nNext stepLast step\n\n×\n\nGraphic verification\n\n![captcha](https://potato.im/)\n\nYour browser does not support audio, please refresh the authentication method\n\n![refresh](https://potato.im/resources/images/email/icon_refresh.png)\n\n\"\n\nOK\n\nTips\n\nI see\n\nSend success\n\nMake communications simple, safe, reliable and interesting for users around the world\n\nWith POTATO you can send and receive messages and calls quickly, easily and securely from all over the world, while you can enjoy the safest entertainment experience.\n\n__\n\nWindows\n\n[__ Download Windows client](https://download.potato.im/win/Potato_Desktop2.47.28.zip)\n\n__\n\nmacOS\n\n[__ Download the MacOS client](https://download.potato.im/mac/Potato_Desktop2.47.3.dmg)\n\n__\n\nAndroid\n\n[__ Official website download](https://ptapk.potato.im/android/latest.apk)\n\n__\n\niPhone\n\n[__ AppStore](https://itunes.apple.com/us/app/potato-chat/id1204726898) [__ Testflight](https://testflight.apple.com/join/P2Jlp35o)\n\n[Learn More](https://potato.im/apps)\n\n![](https://potato.im/resources/images/index/image_ui_web@2x.png)\n\nWhy do global users choose Potato Chat?\n\n![](https://potato.im/resources/images/gdct/ic_applets.svg)\n\nMini Programs\n\nExperience it without downloading and installation\n\n![](https://potato.im/resources/images/gdct/ic_cloudstorage.svg)\n\nCloud\n\nSupport multi-terminal login, message will synchronize automatically\n\n![](https://potato.im/resources/images/gdct/ic_safety.svg)\n\nSafe\n\nUse the most advacnced encryption technology to ensure information security\n\n![](https://potato.im/resources/images/gdct/ic_powerful.svg)\n\nFree\n\nNo limits on message and file sizes\n\n![](https://potato.im/resources/images/gdct/ic_rapid.svg)\n\nFast\n\nProvides users with super-fast connections and experience\n\n![](https://potato.im/resources/images/gdct/ic_wallet.svg)\n\nWallet & Web3.0 Wallet\n\nSupport global digital currency, multi-currency management, payment and red envelopes\n\n![](https://potato.im/resources/images/gdct/ic_permission.svg)\n\nBot\n\nFreely create bots through API\n\n![](https://potato.im/resources/images/gdct/ic_grouping.svg)\n\nGroups\n\nCreate a super group of up to 200,000 members\n\n![](https://potato.im/resources/images/gdct/ic_privacy.svg)\n\nPrivacy\n\nMessage encryption can be customized to self-destruction\n\n![](https://potato.im/resources/images/gdct/ic_open.svg)\n\nOpen\n\nA diverse and free platform\n\n![](https://potato.im/resources/images/gdct/ic_taste.svg)\n\nFun\n\nFind funny things and interesting people\n\n![](https://potato.im/resources/images/gdct/ic_video.svg)\n\nVideo Call\n\nExperience high-quality voice and video calls for free\n\n![](https://potato.im/resources/images/gdct/ic_circleoffriends.svg)\n\nMoments\n\nShare and post updates\n\n![](https://potato.im/resources/images/gdct/ic_peoplenearby.svg)\n\nPeople Nearby\n\nFind your friends based on location\n\n![](https://potato.im/resources/images/index/ic_fansx.svg)\n\nFansX\n\nEveryone is a creator, making creation more free, simpler, safer and more valuable\n\n- Mobile Apps\n- [Android](https://potato.im/changelog#mAndroid)\n- [iOS](https://potato.im/changelog#miOS)\n\n- Desktop Apps\n- [macOS](https://potato.im/changelog#mMacOS)\n- [Windows](https://potato.im/changelog#mWindows)\n- [Linux](https://potato.im/changelog#mLinux)\n\n- Official Community\n- [Follow Twitter](https://twitter.com/PotatoChatApp)\n- [Business Email](mailto:business@potato.im)\n- [Technical Support Email](mailto:support@potato.im)\n- [Administrator Email](mailto:webadmin@potato.im)\n\n- Subscribe to us\n- Email address is wrong, please re-enter\n\n\n\n\nSuccessfully！\n\n\n\nCongratulations, the subscription is successful\n\n\n\nSorry, subscription failed\n\n\n\nSorry, subscription failed",
  "markdown": "Your browser version is too low, some content may not display properly, please download the\nlatest version!\n\n[HOME](https://potato.im/) [APPS](https://potato.im/apps) [DEVELOPER](https://potato.im/api) [FAQ](https://potato.im/faq) [PRIVACY](https://potato.im/privacy) [NEWS](https://potato.im/news)\n\n简体中文English繁體中文\n[__](https://twitter.com/PotatoChatApp)\n\n__\n\nFeedback\n\n__\n[Service\\\\\n\\\\\n__](https://tdkh.gsxhtmy.com/chatIndex?kefu_id=kefu2&extra=eyJhcHBfdmVyc2lvbiI6IiIsIm9zX3R5cGUiOiJ3ZWIiLCJrZXlfaWQiOiIiLCJ1c2VyX2lkIjoiIiwiYWNjb3VudCI6IiJ9) [News\\\\\n\\\\\n__](https://potato.im/news)\n\nFeedback一\n\nEnter the problem you are experiencing\n\n**0**/520\n\nUnited States+1\n\nAfghanistan\n\n+93\n\nAlbania\n\n+355\n\nAlgeria\n\n+213\n\nAmerican Samoa\n\n+1684\n\nAndorra\n\n+376\n\nAngola\n\n+244\n\nAnguilla\n\n+1264\n\nAntarctica\n\n+0\n\nAntigua and Barbuda\n\n+1268\n\nArgentina\n\n+54\n\nArmenia\n\n+374\n\nAruba\n\n+297\n\nAustralia\n\n+61\n\nAustria\n\n+43\n\nAzerbaijan\n\n+994\n\nBahamas\n\n+1242\n\nBahrain\n\n+973\n\nBangladesh\n\n+880\n\nBarbados\n\n+1246\n\nBelarus\n\n+375\n\nBelgium\n\n+32\n\nBelize\n\n+501\n\nBenin\n\n+229\n\nBermuda\n\n+1441\n\nBhutan\n\n+975\n\nBolivia\n\n+591\n\nBosnia and Herzegovina\n\n+387\n\nBotswana\n\n+267\n\nBouvet Island\n\n+0\n\nBrazil\n\n+55\n\nBritish Indian Ocean Territory\n\n+246\n\nBrunei Darussalam\n\n+673\n\nBulgaria\n\n+359\n\nBurkina Faso\n\n+226\n\nBurundi\n\n+257\n\nCambodia\n\n+855\n\nCameroon\n\n+237\n\nCanada\n\n+1\n\nCape Verde\n\n+238\n\nCayman Islands\n\n+1345\n\nCentral African Republic\n\n+236\n\nChad\n\n+235\n\nChile\n\n+56\n\nChina\n\n+86\n\nChristmas Island\n\n+61\n\nCocos (Keeling) Islands\n\n+672\n\nColombia\n\n+57\n\nComoros\n\n+269\n\nCongo\n\n+242\n\nCongo, the Democratic Republic of the\n\n+242\n\nCook Islands\n\n+682\n\nCosta Rica\n\n+506\n\nCote D'Ivoire\n\n+225\n\nCroatia\n\n+385\n\nCuba\n\n+53\n\nCyprus\n\n+357\n\nCzech Republic\n\n+420\n\nDenmark\n\n+45\n\nDjibouti\n\n+253\n\nDominica\n\n+1767\n\nDominican Republic\n\n+1809\n\nEcuador\n\n+593\n\nEgypt\n\n+20\n\nEl Salvador\n\n+503\n\nEquatorial Guinea\n\n+240\n\nEritrea\n\n+291\n\nEstonia\n\n+372\n\nEthiopia\n\n+251\n\nFalkland Islands (Malvinas)\n\n+500\n\nFaroe Islands\n\n+298\n\nFiji\n\n+679\n\nFinland\n\n+358\n\nFrance\n\n+33\n\nFrench Guiana\n\n+594\n\nFrench Polynesia\n\n+689\n\nFrench Southern Territories\n\n+0\n\nGabon\n\n+241\n\nGambia\n\n+220\n\nGeorgia\n\n+995\n\nGermany\n\n+49\n\nGhana\n\n+233\n\nGibraltar\n\n+350\n\nGreece\n\n+30\n\nGreenland\n\n+299\n\nGrenada\n\n+1473\n\nGuadeloupe\n\n+590\n\nGuam\n\n+1671\n\nGuatemala\n\n+502\n\nGuinea\n\n+224\n\nGuinea-Bissau\n\n+245\n\nGuyana\n\n+592\n\nHaiti\n\n+509\n\nHeard Island and Mcdonald Islands\n\n+0\n\nHoly See (Vatican City State)\n\n+39\n\nHonduras\n\n+504\n\nHong Kong\n\n+852\n\nHungary\n\n+36\n\nIceland\n\n+354\n\nIndia\n\n+91\n\nIndonesia\n\n+62\n\nIran, Islamic Republic of\n\n+98\n\nIraq\n\n+964\n\nIreland\n\n+353\n\nIsrael\n\n+972\n\nItaly\n\n+39\n\nJamaica\n\n+1876\n\nJapan\n\n+81\n\nJordan\n\n+962\n\nKazakhstan\n\n+7\n\nKenya\n\n+254\n\nKiribati\n\n+686\n\nKorea, Democratic People's Republic of\n\n+850\n\nKorea, Republic of\n\n+82\n\nKuwait\n\n+965\n\nKyrgyzstan\n\n+996\n\nLao People's Democratic Republic\n\n+856\n\nLatvia\n\n+371\n\nLebanon\n\n+961\n\nLesotho\n\n+266\n\nLiberia\n\n+231\n\nLibyan Arab Jamahiriya\n\n+218\n\nLiechtenstein\n\n+423\n\nLithuania\n\n+370\n\nLuxembourg\n\n+352\n\nMacao\n\n+853\n\nMacedonia, the Former Yugoslav Republic of\n\n+389\n\nMadagascar\n\n+261\n\nMalawi\n\n+265\n\nMalaysia\n\n+60\n\nMaldives\n\n+960\n\nMali\n\n+223\n\nMalta\n\n+356\n\nMarshall Islands\n\n+692\n\nMartinique\n\n+596\n\nMauritania\n\n+222\n\nMauritius\n\n+230\n\nMayotte\n\n+269\n\nMexico\n\n+52\n\nMicronesia, Federated States of\n\n+691\n\nMoldova, Republic of\n\n+373\n\nMonaco\n\n+377\n\nMongolia\n\n+976\n\nMontserrat\n\n+1664\n\nMorocco\n\n+212\n\nMozambique\n\n+258\n\nMyanmar\n\n+95\n\nNamibia\n\n+264\n\nNauru\n\n+674\n\nNepal\n\n+977\n\nNetherlands\n\n+31\n\nNetherlands Antilles\n\n+599\n\nNew Caledonia\n\n+687\n\nNew Zealand\n\n+64\n\nNicaragua\n\n+505\n\nNiger\n\n+227\n\nNigeria\n\n+234\n\nNiue\n\n+683\n\nNorfolk Island\n\n+672\n\nNorthern Mariana Islands\n\n+1670\n\nNorway\n\n+47\n\nOman\n\n+968\n\nPakistan\n\n+92\n\nPalau\n\n+680\n\nPalestinian Territory, Occupied\n\n+970\n\nPanama\n\n+507\n\nPapua New Guinea\n\n+675\n\nParaguay\n\n+595\n\nPeru\n\n+51\n\nPhilippines\n\n+63\n\nPitcairn\n\n+0\n\nPoland\n\n+48\n\nPortugal\n\n+351\n\nPuerto Rico\n\n+1787\n\nQatar\n\n+974\n\nReunion\n\n+262\n\nRomania\n\n+40\n\nRussian Federation\n\n+70\n\nRwanda\n\n+250\n\nSaint Helena\n\n+290\n\nSaint Kitts and Nevis\n\n+1869\n\nSaint Lucia\n\n+1758\n\nSaint Pierre and Miquelon\n\n+508\n\nSaint Vincent and the Grenadines\n\n+1784\n\nSamoa\n\n+684\n\nSan Marino\n\n+378\n\nSao Tome and Principe\n\n+239\n\nSaudi Arabia\n\n+966\n\nSenegal\n\n+221\n\nSerbia and Montenegro\n\n+381\n\nSeychelles\n\n+248\n\nSierra Leone\n\n+232\n\nSingapore\n\n+65\n\nSlovakia\n\n+421\n\nSlovenia\n\n+386\n\nSolomon Islands\n\n+677\n\nSomalia\n\n+252\n\nSouth Africa\n\n+27\n\nSouth Georgia and the South Sandwich Islands\n\n+0\n\nSpain\n\n+34\n\nSri Lanka\n\n+94\n\nSudan\n\n+249\n\nSuriname\n\n+597\n\nSvalbard and Jan Mayen\n\n+47\n\nSwaziland\n\n+268\n\nSweden\n\n+46\n\nSwitzerland\n\n+41\n\nSyrian Arab Republic\n\n+963\n\nTaiwan, Province of China\n\n+886\n\nTajikistan\n\n+992\n\nTanzania, United Republic of\n\n+255\n\nThailand\n\n+66\n\nTimor-Leste\n\n+670\n\nTogo\n\n+228\n\nTokelau\n\n+690\n\nTonga\n\n+676\n\nTrinidad and Tobago\n\n+1868\n\nTunisia\n\n+216\n\nTurkey\n\n+90\n\nTurkmenistan\n\n+7370\n\nTurks and Caicos Islands\n\n+1649\n\nTuvalu\n\n+688\n\nUganda\n\n+256\n\nUkraine\n\n+380\n\nUnited Arab Emirates\n\n+971\n\nUnited Kingdom\n\n+44\n\nUnited States\n\n+1\n\nUnited States Minor Outlying Islands\n\n+1\n\nUruguay\n\n+598\n\nUzbekistan\n\n+998\n\nVanuatu\n\n+678\n\nVenezuela\n\n+58\n\nViet Nam\n\n+84\n\nVirgin Islands, British\n\n+1284\n\nVirgin Islands, U.s.\n\n+1340\n\nWallis and Futuna\n\n+681\n\nWestern Sahara\n\n+212\n\nYemen\n\n+967\n\nZambia\n\n+260\n\nZimbabwe\n\n+263\n\nUpload photos\n\n![](https://potato.im/resources/images/btn_addphoto.png)\n\n\\*Two pictures could be uploaded at most one time, and the network capacity size of every picture cannot be over 3M.\n\nSubmit\n\nHot issue\n\nMobile phone can not be logged in, quickly bind email address\n\nHOT\n\n[Why do I need to register by email?](https://potato.im/faq?md=whyBindEmail)\n\nHOT\n\n[How to download the latest version of Potato?](https://potato.im/apps)\n\n[What if the registration/login fails to send the verification code?](https://potato.im/faq?md=RegMsgNotCode)\n\n[Potato FAQ](https://potato.im/faq)\n\nService\n\n×\n\nGraphic verification\n\n![captcha](https://potato.im/)\n\n![refresh](https://potato.im/resources/images/email/icon_refresh.png)\n\n\"\n\nOK\n\nBinding Email一\n\nPlease enter your phone number\n\nAfghanistan,+93Albania,+355Algeria,+213American Samoa,+1684Andorra,+376Angola,+244Anguilla,+1264Antarctica,+0Antigua and Barbuda,+1268Argentina,+54Armenia,+374Aruba,+297Australia,+61Austria,+43Azerbaijan,+994Bahamas,+1242Bahrain,+973Bangladesh,+880Barbados,+1246Belarus,+375Belgium,+32Belize,+501Benin,+229Bermuda,+1441Bhutan,+975Bolivia,+591Bosnia and Herzegovina,+387Botswana,+267Bouvet Island,+0Brazil,+55British Indian Ocean Territory,+246Brunei Darussalam,+673Bulgaria,+359Burkina Faso,+226Burundi,+257Cambodia,+855Cameroon,+237Canada,+1Cape Verde,+238Cayman Islands,+1345Central African Republic,+236Chad,+235Chile,+56China,+86Christmas Island,+61Cocos (Keeling) Islands,+672Colombia,+57Comoros,+269Congo,+242Congo, the Democratic Republic of the,+242Cook Islands,+682Costa Rica,+506Cote D'Ivoire,+225Croatia,+385Cuba,+53Cyprus,+357Czech Republic,+420Denmark,+45Djibouti,+253Dominica,+1767Dominican Republic,+1809Ecuador,+593Egypt,+20El Salvador,+503Equatorial Guinea,+240Eritrea,+291Estonia,+372Ethiopia,+251Falkland Islands (Malvinas),+500Faroe Islands,+298Fiji,+679Finland,+358France,+33French Guiana,+594French Polynesia,+689French Southern Territories,+0Gabon,+241Gambia,+220Georgia,+995Germany,+49Ghana,+233Gibraltar,+350Greece,+30Greenland,+299Grenada,+1473Guadeloupe,+590Guam,+1671Guatemala,+502Guinea,+224Guinea-Bissau,+245Guyana,+592Haiti,+509Heard Island and Mcdonald Islands,+0Holy See (Vatican City State),+39Honduras,+504Hong Kong,+852Hungary,+36Iceland,+354India,+91Indonesia,+62Iran, Islamic Republic of,+98Iraq,+964Ireland,+353Israel,+972Italy,+39Jamaica,+1876Japan,+81Jordan,+962Kazakhstan,+7Kenya,+254Kiribati,+686Korea, Democratic People's Republic of,+850Korea, Republic of,+82Kuwait,+965Kyrgyzstan,+996Lao People's Democratic Republic,+856Latvia,+371Lebanon,+961Lesotho,+266Liberia,+231Libyan Arab Jamahiriya,+218Liechtenstein,+423Lithuania,+370Luxembourg,+352Macao,+853Macedonia, the Former Yugoslav Republic of,+389Madagascar,+261Malawi,+265Malaysia,+60Maldives,+960Mali,+223Malta,+356Marshall Islands,+692Martinique,+596Mauritania,+222Mauritius,+230Mayotte,+269Mexico,+52Micronesia, Federated States of,+691Moldova, Republic of,+373Monaco,+377Mongolia,+976Montserrat,+1664Morocco,+212Mozambique,+258Myanmar,+95Namibia,+264Nauru,+674Nepal,+977Netherlands,+31Netherlands Antilles,+599New Caledonia,+687New Zealand,+64Nicaragua,+505Niger,+227Nigeria,+234Niue,+683Norfolk Island,+672Northern Mariana Islands,+1670Norway,+47Oman,+968Pakistan,+92Palau,+680Palestinian Territory, Occupied,+970Panama,+507Papua New Guinea,+675Paraguay,+595Peru,+51Philippines,+63Pitcairn,+0Poland,+48Portugal,+351Puerto Rico,+1787Qatar,+974Reunion,+262Romania,+40Russian Federation,+70Rwanda,+250Saint Helena,+290Saint Kitts and Nevis,+1869Saint Lucia,+1758Saint Pierre and Miquelon,+508Saint Vincent and the Grenadines,+1784Samoa,+684San Marino,+378Sao Tome and Principe,+239Saudi Arabia,+966Senegal,+221Serbia and Montenegro,+381Seychelles,+248Sierra Leone,+232Singapore,+65Slovakia,+421Slovenia,+386Solomon Islands,+677Somalia,+252South Africa,+27South Georgia and the South Sandwich Islands,+0Spain,+34Sri Lanka,+94Sudan,+249Suriname,+597Svalbard and Jan Mayen,+47Swaziland,+268Sweden,+46Switzerland,+41Syrian Arab Republic,+963Taiwan, Province of China,+886Tajikistan,+992Tanzania, United Republic of,+255Thailand,+66Timor-Leste,+670Togo,+228Tokelau,+690Tonga,+676Trinidad and Tobago,+1868Tunisia,+216Turkey,+90Turkmenistan,+7370Turks and Caicos Islands,+1649Tuvalu,+688Uganda,+256Ukraine,+380United Arab Emirates,+971United Kingdom,+44United States,+1United States Minor Outlying Islands,+1Uruguay,+598Uzbekistan,+998Vanuatu,+678Venezuela,+58Viet Nam,+84Virgin Islands, British,+1284Virgin Islands, U.s.,+1340Wallis and Futuna,+681Western Sahara,+212Yemen,+967Zambia,+260Zimbabwe,+263\n\n+\n\n\"\n\nPlease enter phone verification code\n\nGet CAPTCHA\n\n\"\n\nNext step\n\n![logo](https://potato.im/resources/images/email/logo@2x.png)\n\nPlease send a text message to the corresponding phone number for verification\n\n电信用户请编辑短信 1111\n发送至:1234\n\n移动用户请编辑短信 2222\n发送至:2234\n\n联通用户请编辑短信 3333\n发送至:3234\n\nEnsure that the mobile phone number and message content are entered correctly to avoid sending errors.\n\nAlready send\n\n+899 66668888\n\n![avatar](https://potato.im/)\n\nNickname\n\nUser name\n\nThis email address is already tied to an account:e\\*\\*\\*\\*mail@email.com\n\nIf you have any questions, [please contact customer service](https://tdkh.gsxhtmy.com/chatIndex?kefu_id=kefu2&extra=eyJhcHBfdmVyc2lvbiI6IiIsIm9zX3R5cGUiOiJ3ZWIiLCJrZXlfaWQiOiIiLCJ1c2VyX2lkIjoiIiwiYWNjb3VudCI6IiJ9)\n\nSuccessfully bound mailbox\n\nPlease use your e-mail to log in\n\nYou will bind an e-mail address to this account\n\n下一步\n\nLast step\n\nDownload Potato：Mobile\n\n[![android](https://potato.im/resources/images/email/icon_apps_android.png)Potato Android](https://ptapk.potato.im/android/latest.apk)\n\n[![iphone](https://potato.im/resources/images/email/icon_apps_ios.png)Potato iPhone](https://itunes.apple.com/us/app/potato-chat/id1204726898)\n\nDesktop\n\n[![windows](https://potato.im/resources/images/email/icon_apps_win.png)Potato Windows Desktop](https://download.potato.im/win/Potato_Desktop2.47.28.zip)\n\n[![macos](https://potato.im/resources/images/email/icon_apps_macos.png)Potato MacOS Desktop](https://download.potato.im/mac/Potato_Desktop2.47.3.dmg)\n\n[![linux](https://potato.im/resources/images/email/icon_apps_linux.png)Potato Linux Desktop](https://download.potato.im/linux/Potato_Desktop.2.37.tar.gz)\n\nPlease enter your e-mail address\n\n\"\n\nPlease enter the e-mail verification code\n\nGet CAPTCHA\n\n\"\n\nNext stepLast step\n\n×\n\nGraphic verification\n\n![captcha](https://potato.im/)\n\nYour browser does not support audio, please refresh the authentication method\n\n![refresh](https://potato.im/resources/images/email/icon_refresh.png)\n\n\"\n\nOK\n\nTips\n\nI see\n\nSend success\n\nMake communications simple, safe, reliable and interesting for users around the world\n\nWith POTATO you can send and receive messages and calls quickly, easily and securely from all over the world, while you can enjoy the safest entertainment experience.\n\n__\n\nWindows\n\n[__ Download Windows client](https://download.potato.im/win/Potato_Desktop2.47.28.zip)\n\n__\n\nmacOS\n\n[__ Download the MacOS client](https://download.potato.im/mac/Potato_Desktop2.47.3.dmg)\n\n__\n\nAndroid\n\n[__ Official website download](https://ptapk.potato.im/android/latest.apk)\n\n__\n\niPhone\n\n[__ AppStore](https://itunes.apple.com/us/app/potato-chat/id1204726898) [__ Testflight](https://testflight.apple.com/join/P2Jlp35o)\n\n[Learn More](https://potato.im/apps)\n\n![](https://potato.im/resources/images/index/image_ui_web@2x.png)\n\nWhy do global users choose Potato Chat?\n\n![](https://potato.im/resources/images/gdct/ic_applets.svg)\n\nMini Programs\n\nExperience it without downloading and installation\n\n![](https://potato.im/resources/images/gdct/ic_cloudstorage.svg)\n\nCloud\n\nSupport multi-terminal login, message will synchronize automatically\n\n![](https://potato.im/resources/images/gdct/ic_safety.svg)\n\nSafe\n\nUse the most advacnced encryption technology to ensure information security\n\n![](https://potato.im/resources/images/gdct/ic_powerful.svg)\n\nFree\n\nNo limits on message and file sizes\n\n![](https://potato.im/resources/images/gdct/ic_rapid.svg)\n\nFast\n\nProvides users with super-fast connections and experience\n\n![](https://potato.im/resources/images/gdct/ic_wallet.svg)\n\nWallet & Web3.0 Wallet\n\nSupport global digital currency, multi-currency management, payment and red envelopes\n\n![](https://potato.im/resources/images/gdct/ic_permission.svg)\n\nBot\n\nFreely create bots through API\n\n![](https://potato.im/resources/images/gdct/ic_grouping.svg)\n\nGroups\n\nCreate a super group of up to 200,000 members\n\n![](https://potato.im/resources/images/gdct/ic_privacy.svg)\n\nPrivacy\n\nMessage encryption can be customized to self-destruction\n\n![](https://potato.im/resources/images/gdct/ic_open.svg)\n\nOpen\n\nA diverse and free platform\n\n![](https://potato.im/resources/images/gdct/ic_taste.svg)\n\nFun\n\nFind funny things and interesting people\n\n![](https://potato.im/resources/images/gdct/ic_video.svg)\n\nVideo Call\n\nExperience high-quality voice and video calls for free\n\n![](https://potato.im/resources/images/gdct/ic_circleoffriends.svg)\n\nMoments\n\nShare and post updates\n\n![](https://potato.im/resources/images/gdct/ic_peoplenearby.svg)\n\nPeople Nearby\n\nFind your friends based on location\n\n![](https://potato.im/resources/images/index/ic_fansx.svg)\n\nFansX\n\nEveryone is a creator, making creation more free, simpler, safer and more valuable\n\n- Mobile Apps\n- [Android](https://potato.im/changelog#mAndroid)\n- [iOS](https://potato.im/changelog#miOS)\n\n- Desktop Apps\n- [macOS](https://potato.im/changelog#mMacOS)\n- [Windows](https://potato.im/changelog#mWindows)\n- [Linux](https://potato.im/changelog#mLinux)\n\n- Official Community\n- [Follow Twitter](https://twitter.com/PotatoChatApp)\n- [Business Email](mailto:business@potato.im)\n- [Technical Support Email](mailto:support@potato.im)\n- [Administrator Email](mailto:webadmin@potato.im)\n\n- Subscribe to us\n- Email address is wrong, please re-enter\n\n\n\n\nSuccessfully！\n\n\n\nCongratulations, the subscription is successful\n\n\n\nSorry, subscription failed\n\n\n\nSorry, subscription failed",
  "linksOnPage": [
    "https://potato.im/",
    "https://potato.im/apps",
    "https://potato.im/api",
    "https://potato.im/faq",
    "https://potato.im/privacy",
    "https://potato.im/news",
    "https://twitter.com/PotatoChatApp",
    "https://tdkh.gsxhtmy.com/chatIndex?kefu_id=kefu2&extra=eyJhcHBfdmVyc2lvbiI6IiIsIm9zX3R5cGUiOiJ3ZWIiLCJrZXlfaWQiOiIiLCJ1c2VyX2lkIjoiIiwiYWNjb3VudCI6IiJ9",
    "https://potato.im/faq?md=whyBindEmail",
    "https://potato.im/faq?md=RegMsgNotCode",
    "pt://resolve?domain=support_bot",
    "https://ptapk.potato.im/android/latest.apk",
    "https://itunes.apple.com/us/app/potato-chat/id1204726898",
    "https://download.potato.im/win/Potato_Desktop2.47.28.zip",
    "https://download.potato.im/mac/Potato_Desktop2.47.3.dmg",
    "https://download.potato.im/linux/Potato_Desktop.2.37.tar.gz",
    "https://testflight.apple.com/join/P2Jlp35o",
    "https://potato.im/changelog#mAndroid",
    "https://potato.im/changelog#miOS",
    "https://potato.im/changelog#mMacOS",
    "https://potato.im/changelog#mWindows",
    "https://potato.im/changelog#mLinux",
    "mailto:business@potato.im",
    "mailto:support@potato.im",
    "mailto:webadmin@potato.im"
  ],
  "metadata": {
    "viewport": "width=device-width, initial-scale=1, shrink-to-fit=no",
    "ogDescription": "Fast. Secure. Powerful.",
    "language": "en",
    "description": "Potato is an instant messenger focused on security. It is faster, more secure, more open and completely free. Available on IOS, Android, Windows , MacOS and Linux. You can create super groups with 200,000 members, super channels, support voice and video calls, send photos, send videos, stickers and Gifs, and there is no file size limit, etc. It provides you with full privacy settings and the most secure and stable chat environment. Moreover, Potato is an expert in protecting your digital currency.",
    "keywords": "Potato,chat,mobile,video,voice,message,send message,send photo,free,im,potato.im,chat messenger,chat tool,instant message,secure chats,private chats,voice call,video call,Moments,Album,Apps,Download,send pictures,super group,channel,wallet,digital wallet,AI,Bot,Bot API,opening platform",
    "og:image": "https://www.potato.im/resources/images/logo1024.png",
    "ogImage": "https://www.potato.im/resources/images/logo1024.png",
    "ogSiteName": "Potato",
    "fb:app_id": "1222245288686627",
    "og:title": "Potato – a new era of messaging",
    "og:url": "https://www.potato.im",
    "og:description": "Fast. Secure. Powerful.",
    "title": "Potato",
    "favicon": "https://potato.im/resources/images/ico.ico",
    "ogTitle": "Potato – a new era of messaging",
    "og:site_name": "Potato",
    "ogUrl": "https://www.potato.im",
    "scrapeId": "77bfcfd2-c4b3-4dfd-8c3b-bb4e6d4eb0ea",
    "sourceURL": "https://potato.im/",
    "url": "https://potato.im/",
    "contentType": "text/html;charset=UTF-8",
    "proxyUsed": "basic",
    "pageStatusCode": 200
  }
}